MCQ,Choices,Correct
What is machine learning?,a: The study of artificial intelligence concerned with the development and study of statistical algorithms | b: The study of computer gaming and artificial intelligence | c: The study of human cognitive processes | d: The study of mathematical optimization methods,a
What is the synonym for machine learning used in the 1950s?,a: Generative artificial neural networks | b: Self-teaching computers | c: Mathematical optimization methods | d: Computational statistics,b
Who coined the term machine learning?,a: Arthur Samuel | b: Donald Hebb | c: Walter Pitts | d: Warren McCulloch,a
What is the purpose of modern-day machine learning?,a: To develop models for classifying data | b: To make predictions for future outcomes | c: Both a and b | d: None of the above,c
What is an example of a machine learning algorithm?,"a: Computer vision of moles for classifying cancerous moles | b: Analyzing sonar signals, electrocardiograms, and speech patterns | c: Recognizing 40 characters from a computer terminal | d: All of the above",d
